"ad_url","ad_city","ad_neighborhood","ad_type","ad_description","ad_hash","ad_price","ad_currency","ad_kvm","ad_price_per_kvm","ad_street","updated_ts","ord"
https://www.imot.bg/pcgi/imot.cgi?act=5&adv=1b167905678159272,град София,Център,"2-СТАЕН","First Estates представя на вашето внимание двустаен апартамент за продажба в центъра на София. Имотът се намира на минути от Катедралата Александър Невски, Парламенти, президентството, и градски градини.Имотът е подходящ за човек, който търси специфичния стил на живот в центрлната част на София.Апартаментът е стилно и удобно обзаведен и предлага:- слънчева дневна стая- отделна и оборудвана кухня- спалня;- 1 баня- 1 тоалетна- терасаЗа повече информация и огледи, моля свърежете се на с нас на тел: 0700 15 151 или 02 980 20 68 и посоченте реф. No..10590",f7dc846056b0817af330f940a66f7a06ad55f710ddf2ee3117e5c903b293b778,294000,EUR,86,3418.60,Център,2023-10-11 11:43:58.000,1
https://www.imot.bg/pcgi/imot.cgi?act=5&adv=1b167930519687903,град София,Център,"2-СТАЕН","ОБЗАВЕДЕН апартамент, подходящ и за инвестиция на комуникативно място в близост до институции, градски пътни артерии, спирки на обществен транспорт, метростанция, здравни заведения, училища. Тухлена сграда на ет.4 от 4 без асансьор; Чиста площ по документи: 45 кв.м; РАЗПРЕДЕЛЕНИЕ: дневна с кухня и излаз на тераса, спалня, баня с тоалетна, входно антре. ОТОПЛЕНИЕ: камина на твърдо гориво и климатици във всяко помещение; PVC дограма; ПОДОВИ НАСТИЛКИ: дневна, спалня - теракота и ламиниран паркет, баня с тоалетна - теракота; СТЕНИ: дневна - латекс, спалня - тапети; запазени интериорни врати. ИЗЛОЖЕНИЕ: И/З. Изградена инсталация за СОТ; Добре поддържани общи части с контролиран достъп; Към апартамента има прилежащо мазе 9 кв.м. В ЦЕНАТА СА ВКЛЮЧЕНИ ДВЕ ПАРКОМЕСТА. ЗА ПОВЕЧЕ ПОДРОБНОСТИ И ОГЛЕДИ: тел. 0893410303, оферта А4870","69cde78b95999060b2f2c6890b5802db284e5847528bcbfa8cb56df758b1f45b",124999,EUR,50,2499.98,ул. Княз Борис I,2023-11-02 14:43:05.000,1
https://www.imot.bg/pcgi/imot.cgi?act=5&adv=1b167930790890928,град София,Център,"2-СТАЕН","ТОП ЦЕНТЪР, ул. Алабин, до бул. Витоша, Съдебна палата, метростанция Сердика, транспорт, магазини, офиси, 60 м2, ет. 6 / 7 с асансьор, монолитно строителство от 50-те години. Апартамента се състои от антре, вестибюл, хол, спалня, кухня, баня с тоалетна, балкон, мазе 3 м2 и таван 4 м2, идеални части от земята  Подържан вход и общи части, сменена дограма. Изложение изток/юг/запад. Апартамента е малко бижу, подходящ за живеене, даване под наем, включително краткосрочни наеми, офис, адвокатска, нотариална кантора. Чудесна инвестиция. 0888 88 23 37","836db171aba03ad603fdf24d060a0d2404aceaf882397c3d78e98ff58eeb94ad",214888,EUR,60,3581.47,ул. Алабин,2023-10-12 22:06:54.000,1
https://www.imot.bg/pcgi/imot.cgi?act=5&adv=1b167942171402663,град София,Център,"2-СТАЕН","БЕЗ КОМИСИОН ! ТОП цена на инвеститор ! ТОП място-на 500метра от метростанция Лъвов мост, до училище, детска градина,спирки на градски транспорт . Eлегантна бутикова кооперация с акт 14 на ул.Панагюрище. Централен ТЕЦ . Доказан строител, с дългогодишна история и много построени сгради. Апартаментът се състои от входно антре, дневна с кухненски бокс, спалня, две бани с тоалетни и два балкона ,мазе 3,5 кв.м. Изложение - юг и запад. В сградата има надземни гаражи и паркоместа и вътрешни, независими платформи за вертикално паркиране на две нива - партер и сутерен . Без почивен ден . 0898 246 049","1846c1a8be3cd289862cc991d9fd0169dab21e9ec7efca67fff5510e08630472",124000,EUR,73,1698.63,ул. Панагюрище,2023-10-11 11:45:10.000,1
https://www.imot.bg/pcgi/imot.cgi?act=5&adv=1b167942730545117,град София,Център,"2-СТАЕН","Двустаен апартамент със застроена площ от 70 кв.м. Цената е крайна (с включено ДДС).  Новострояща се сграда, находяща се на ул. Брегалница   53. Сградата е пред АКТ 15. На 3 минути пешеходно разстояние от метростанция 'Опълченска'. Обади се сега и цитирай този код 577522",afa582e71a2fe7ac18903eca09715ad6a89dd70a40f10fe301dd61725b4a9774,165127,EUR,81,2038.60,Център,2023-10-11 11:43:58.000,1
https://www.imot.bg/pcgi/imot.cgi?act=5&adv=1b167946826591901,град София,Център,"2-СТАЕН","Уникален имот в пешеходната част на булевард Витоша. Имотът е със самостоятелен вход и тих вътрешен двор. Състои се от пет помещения - кухня, хол, спалня,баня, склад.Подходящ за живеене, офис, за лично ползване или отдаване под наем дългосрочно или Airbnb. В много добро състояние. Потенциален инвестиционен имот , т.к. към апартамента има 8/100 или 8% идеални части от 300 м2 / Урегулиран поземлен имот/, който представлява ъглов парцел с голямо лице на булевард Витоша и високи параметри за застрояване. Има възможност за нова модерна 9/10 етажна сграда и просторни магазини по цялото партерно ниво на УПИ-то. Инвестицията в този имот е с голям потенциал за  увеличена стойност на вложените средства. За повече информация и огледи: Пламен Петров - 0878430485, 0898430485. ","43cbd328fbfca7a7e4b95e3fd2fe2a3c051c59fb61d65986287fc06068e256e3",228000,EUR,60,3800.00,бул. Витоша,2023-10-11 11:42:37.000,1
https://www.imot.bg/pcgi/imot.cgi?act=5&adv=1b167948101066748,град София,Център,"2-СТАЕН","Апартамент със светла площ 72 кв.м., на втори етаж - първи над партер, състоящ се от вестибюл, дневна, спалня, кухня, килер, санитарно помещение и един балкон. Отопление на ток. Сменена дограма на апартамента.  В широк център, на ул. Отец Паисий, на пешеходно разстояние от пл. Света Неделя, срещу МОЛ София. Кооперация  на три етажа - 6 апартамента; строеж тип пруски свод; високи тавани - 3.10м.; поддържан вътрешен двор; собственост върху земята - УПИ 495кв.м. Сградата е позиционирана във вътрешен двор, което осигурява тишина и спокойствие. Изключително комуникативно място в широк център - на входа на метростанция Опълченска и спирката на трамвая. Голяма кухня, позволяваща преустройство на втора спалня. Към кухнята има килер, който е възможна да се преустрои на втори санитарен възел.  Обади се сега и цитирай този код 577509","2b8404a9027164710ec0e8cba543f04826738091f05c09316b45513f3d3d2197",146000,EUR,72,2027.78,Център,2023-10-11 11:46:06.000,1
https://www.imot.bg/pcgi/imot.cgi?act=5&adv=1b167968435252642,град София,Център,"2-СТАЕН","ДЖОЙ Имоти продава  маломерен двустаен апартамент на  пешеходно разстояние от Мол София, в близост до ул. Одрин . Изключително комуникативно място, с добра транспортна ифраструктура. Жилището е в добре поддържана тухлена кооперация, с реновирани общи части, работещ асансьор и контролиран достъп.Апартаментът е вътрешен, с  едностранно южно изложение, без изглед към бул. Ал.Стамболийски. Състои се от входно антре, хол с преход към стая, отделна кухня и обща баня с тоалетна. Реална квадратура.  Жилището е с подменена PVC дограма и външна изолация.  Нуждае се от съвременен ремонт. Към апартамента има избено помещение.Зелена зона за паркиране.Добър имот както за живеене, така и за инвестиция.За информация и огледи   0898616164 Светла Стоева","745b1de8910a051a2f5c3bca9a893436836d3525b9faa21be5dd7c12d215c5b6",140000,EUR,49,2857.14,бул. Ал. Стамболийски,2023-10-11 11:44:10.000,1
https://www.imot.bg/pcgi/imot.cgi?act=5&adv=1b167990436859550,град София,Център,"2-СТАЕН","Оф 38731 ЧУДЕСЕН АПАРТАМЕНТ, ОТЛИЧНА ЛОКАЦИЯ, ДО МЕТРОСТАНЦИЯ, ВЪТРЕШЕН, ТЕЦ!!! Състои се от: хол, спалня с тераса, кухня, коридор и баня с тоалетна. Към жилището има мазе и идеална част от двора, където може да се паркира 1 автомобил. Сградата е с асансьор, добре подържани общи части. АКЦЕНТИ   ЦЕНТЪР, МОНОЛИТНА СГРАДА! За контакти: Захари Кръстев - 02/4928535 (вътр. 201);моб - 0886/516622 и мейл: [email protected]  Професионално  съдействие от ИМОТИ ДОВЕРИЕ при кандидатстване за кредит. Вижте още подобни имоти на www.imotidoverie.com","3b001841a394071edc4eef824ddae8ce6dec68719f862d703fc25e486a9c9dbe",180000,EUR,70,2571.43,бул. Княгиня Мария Луиза,2023-10-11 11:46:28.000,1
https://www.imot.bg/pcgi/imot.cgi?act=5&adv=1b167991112425388,град София,Център,"2-СТАЕН"," Титан Пропъртис представя на Вашето внимание двустаен апартамент в Центъра на гр. София. В близост са разположени множество детски градини, училища, спирки на градски транспорт, търговски обекти, медицински заведения, зони за отдих и спорт, както и метростанция 'Национален дворец на културата', която е на 220 м. пешеходно разстояние. Апартаментът е ситуиран на 2-ри жилищен етаж и разполага с площ от 50 кв.м., разгърната по следния практичен начин: антре, дневна с трапезария и кухненски бокс, спалня, баня с тоалетна, тераса. Изложение: изток/север. Отопление: ТЕЦ. Жилището се продава напълно обзаведено, с всичко необходимо за едно домакинство. За оглед на това и други атрактивни предложения, не се колебайте да ни потърсите на посочения телефон или да ни изпратите данните си чрез формата за запитване на сайта. Реф. номер: 30240.","29d6cacc1dae65f56dacbec034a3b48d593c899d99c37b651977311212ccda3c",250000,EUR,50,5000.00,Център,2023-10-11 11:43:23.000,1
https://www.imot.bg/pcgi/imot.cgi?act=5&adv=1b167992212699651,град София,Център,"2-СТАЕН","ДРИЙМ ВИЖЪН НЕДВИЖИМИ ИМОТИ Продава двустаен апартамент в центъра на град София. Намира се в малка бутикова сграда, разположена на много комуникативно място в близост до МОЛ София, метростанция, детска градина, училища и множество помещения от обслужващият сектор. Състои се от входно антре, просторна дневна с кухненски бокс и трапезария, спалня, баня с тоалетна, тераса. Предава се на шпакловка и замазка. Луксозни общи части. Качествено строителство от ДОКАЗАЛ СЕ В ГОДИНИТЕ СТРОИТЕЛ. Възможност за закупуване на паркоместа и гаражи. В сградата предлагаме и други апартаменти. Всички наши обяви ги работим с колеги. Оферта в агенцията 9355. Още наши оферти може да намерите на www. dreamvision. bg Телефони за връзка: 02/421 96 35 ; 0886 13 22 91 Димитър Георгиев",ae336b7937beeb45d1b1cc7f2b349335163bf7584614a03c8d9adb163b3ffbb5,170000,EUR,80,2125.00,Център,2023-10-11 11:46:04.000,1
https://www.imot.bg/pcgi/imot.cgi?act=5&adv=1b168009977937994,град София,Център,"2-СТАЕН","Елегантен двустаен с двоен хол на тихо и спокойно място. Престижна локация на минути пешеходно разстояние от НДК, бул. Витоша и Медицинска академия, паркове, институции, администрации. Район с уредена инфраструктура. Изключително комуникативно място с две близки метростанции - бул. Витоша и Медицинска академия. В близост има парк, градинки, множество заведения, училища, детски градини и магазини. Сградата е с контролиран достъп и с по два апартамента на етаж. Има собствен вътрешен двор с нови пейки и озеленяване по европйски проект. Апартаментът е с изложение юг/изток/запад и изглед изцяло към вътрешен двор. Състои се от входно антре, светъл вестибюл, хол, преходна стая, кухня и баня с тоалетна. Немска дограма - троен стъклопакет 4 сезона, двуплоскостно отваряне и отваряне на всички крила. Интериорни врати - естествен фурнир. Окачени тавани, скрито осветление с димери за плавно усилване и намаляване на светлината. Чисто нова баня с тоалетна- италианска стъклокерамика ръчна изработка лимитирана серия, италиански фаянс. Предстои монтаж на стъклена преграда с врата за душ- пространството и шкаф-мивка по поръчка.В ремонта и са вложени качествени и скъпи материали. Топломери и водомери с дистанционно отчитане. Идеални части от двор и мазе 8 кв.м. Сменен изцяло покрив на сградата -юни. 2023 г. с гаранция 10 г. на ремонта. 0878928703, 0888237530 Виж по-малко... Виж повече","46fe26081692add4b0c63ebf62df1c02ed35898292eae4b94a2ddaa6a38cc8db",320000,EUR,70,4571.43,Център,2023-10-11 11:45:47.000,1
https://www.imot.bg/pcgi/imot.cgi?act=5&adv=1b168019101507765,град София,Център,"2-СТАЕН","Отличен двустаен апартамент,близо до пазара Димитър Петков.Сменена дограма.Настилката на пода е гранитогрес.Стени на латекс.Разпределението е:дневна с кухненски бокс,преходна спална.Баня с тоалетна.Мазе 12м.кв.Входа се заключва.Близо до метро и спирки на градски транспорт.Без асанс.втори етаж над партер. Идеални части от земята.Осигурено паркомястоКонсултант: Ваня Кирилова 0878341333ЕППИ - 30 ГОДИНИ СДЕЛКИ С ИМОТИ!",e0696976242517fccae59a9939c7c8e888dcbb0d7f4884d55ff9a876a66ada17,129900,EUR,56,2319.64,ул. Пиротска,2023-10-11 11:43:02.000,1
https://www.imot.bg/pcgi/imot.cgi?act=5&adv=1b168026558386390,град София,Център,"2-СТАЕН","БЕЗ КОМИСИОННА!ЦЕНИ НА СТРОИТЕЛ!Предлагаме на вниманието ви апартаменти в новостроящата се луксозна жилищна сграда в Центъра на София.Сградата е проектирана на осем етажа, като първи етаж е с търговско предназначение и подземен паркинг с гаражи и паркоместа.Разпределение:входно антре (3,69м2), дневна с кухненски бокс(23,25 м2), стая(14,25 м2), балкон(3,77 м2) и склад/мокро. Застроена площ 58,22кв.м.Степен на завършеност: фина шпакловка и замазка, шесткамерни дограми с трислойни стъклопакети, блиндирана входна врата. Локация:Сградата е в близост до Лъвов мост, метростанция, трамвайни, автобусни и тролейбусни спирки. Перфектно място за инвестиция и отдаване под наем.В сградата има свободни паркоместа и гаражи.Същият апартамент се предлага и на трети етаж. Строителната фирма е с дългогодишен опит и високо качество на строителството.Сградата е с модерна архитектура, функционалност и енергоефективност.За контакт: 0898 838385 инж.Л.Цолова","421ec62ab28ba69dd182fbccfc781dd3891a019f6e1e3cf87343bf0b3eb866e2",103935,EUR,69,1506.30,Център,2023-11-09 09:52:20.000,1
https://www.imot.bg/pcgi/imot.cgi?act=5&adv=1b168068505152526,град София,Център,"2-СТАЕН","Арко имоти предлага компактен двустаен ап. състоящ  се  дневна с кухненски бокс ,спалня,WC и тераса.Модерно и качествено строителство, при спазване на съвременните европейски стандарти в бранша. Висок клас на използваните материали. Монолитна стоманобетонна конструкция, оразмерена на земетръс. Външни и вътрешни стени от червени керамични тухли на водещ европейски производител. Осигурени топло-, хидро- и шумо- изолации. Вътрешни мазилки от естествен гипс за здравословна среда. Инсталации, изпълнени със сертифицирани материали на реномирани производители. Стилна фасада с класическа градска архитектура. Френски прозорци. Качествена дограма с немски петкамерен профил. Високо-енергийни и ниско-емисионни стъкла. Голям и безшумен асансьор. Красиви, здрави и сигурни външни врати. Представителни общи части с модерни миещи се вътрешни мазилки в топли цветове и настилки по стълбища и коридори от естествен гранит. Материали, осигуряващи лесна поддръжка, дълговечност и чувство за уют в дома Оферта  81930 Виж по-малко... Виж повече",d850ee9cae79cb9c741745c53f9ede509743ca3c246a13a742858eb319622944,165000,EUR,80,2062.50,Център,2023-10-23 11:02:53.000,1
https://www.imot.bg/pcgi/imot.cgi?act=5&adv=1b168095089385865,град София,Център,"2-СТАЕН","Агенция за недвижими имоти Софиянец представя:Ап.8НОВ ДВУСТАЕН АПАРТАМЕНТ В ЦЕНТЪРА НА ГРАД СОФИЯ!МЕСТОПОЛОЖЕНИЕ:Разположен е на четвърти етаж, в нова сграда, близо до бул.Сливница.СГРАДА:Сградата в която се намира имотът е тухлена, новопостроена на акт.15.РАЗПРЕДЕЛЕНИЕ:Състои се от: входно антре, дневна с кухненски бокс и балкон, спалня с балкон и баня с тоалетна.Застроената площ на апартамента е 49 кв.м.Изложението му е Южно.СЪСТОЯНИЕ:Сградата е оборудвана с голям асансьор и е с луксозни общи части.Имотите се предават на шпакловка и замазка,с качествена дограма, монтирани блиндирани входни врати-SOLID. ЦЕНА:98800 ЕВРО БЕЗ  ДДС.-В СГРАДАТА ИМА  ОЩЕ ЕДИН СВОБОДЕН, ИДЕНТИЧЕН НА ТОЗИ АПАРТАМЕНТ, НО СЕ НАМИРА НА ПЪРВИ ЕТАЖ И Е С ЦЕНА: 92000 ЕВРО БЕЗ ДДС.-СЪЩИЯ ИМОТ ВСЕ ОЩЕ Е СВОБОДЕН И НА ВТОРИ ЕТАЖ, НО Е С ПЕТ КВАДРАТНИ МЕТРА ПО-МАЛЪК И Е СЪС СТАТУТНА АТЕЛИЕ, НЕГОВАТА ЦЕНА Е: 83000 БЕЗ ДДС.Агенцията предлага пълно съдействие за отпускане на банков кредит.Търсим за реален клиент и други имоти в района.Още много оферти, можете да откриете на нашият сайт:https:sofianec.netАКО ВИ ПРЕДСТОИ СДЕЛКА С ИМОТ, ИЗБЕРЕТЕ АГЕНЦИЯ 'СОФИЯНЕЦ'!Консултант:Георги Гергов 0898 250 444 Виж по-малко... Виж повече","83ca96c976deaab985aa2e61aa690b5be7e2147b386d73482910814061d8107c",118500,EUR,62,1911.29,Център,2023-10-11 11:46:36.000,1
