"ad_url","ad_city","ad_neighborhood","ad_type","ad_description","ad_hash","ad_price","ad_currency","ad_kvm","ad_price_per_kvm","ad_street","updated_ts","ord"
https://www.imot.bg/pcgi/imot.cgi?act=5&adv=1b169567164765805,град София,Център,"2-СТАЕН","'Явлена - Изток' продава двустаен апартамент с правилни форми и отлично разпределение в сграда пред АКТ16. Имотътът се намира на тиха улица в централната част на столицата с удобни транспортни връзки и близост до метростанция. Висок клас строителство, без компромис към влаганите материали: термоизолация 'CAPAROL DALMATINA', с дебелина 10 см., допълнителна хидроизолация 'Penetron Admix', 7-камерна дограма 'REHAU Synego' с троен стъклопакет'К-стъкло', бяло стъкло и стъкло 'Четири сезона', луксозно завършени общи части, изпълнени от гранит, мрамор и гранитогрес, асансьор 'KONE' . Жилището е ситуирано на трети етаж и с разпределение: входно антре, просторна дневна с кухненски бокс и трапезария с излаз към тераса, спалня, санитарен възел и складово помещение. Отоплението е на газ. Има възможност за покупка на подземно паркомясто или гараж. За повече информация и детайли по обявата, моля свържете се с водещия брокер. (yavlenaCOM/133036). Виж по-малко... Виж повече","4498cc361c56bb9b2c201b77f3c2ae13adeedf76d0bfed722a3b8495441239ca",178885,EUR,94,1903.03,Център,2023-10-11 11:46:27.000,1
https://www.imot.bg/pcgi/imot.cgi?act=5&adv=1b169571979747095,град София,Център,"2-СТАЕН","Двустаен апартамент в тухлена сграда с асансьор на бул. Васил Левски, в близост до бул. Янко Сакъзов. Разпределение: антре, две стаи, хол, кухня, баня с тоалетна, коридор и балкон. В цената за апартамента са включени мазе и таванско помещение. Сградата разполага със собствен паркинг. ","5dd8d00c0957c88f5d090c460293d4a292a2d9463e63217f1c07d6f4b58b7904",373000,EUR,78,4782.05,бул. Васил Левски,2023-10-17 12:31:06.000,1
https://www.imot.bg/pcgi/imot.cgi?act=5&adv=1b169575757056582,град София,Център,"2-СТАЕН","Явлена представя просторен, 2-стаен апартамент на бул.   Ст. Стамболов'. В тих вътрешен двор с контрол на достъп, санирана сграда.Разпределение: кухня и две самостоятелни стаи, баня с тоалетна. Мазе - 13кв. м. Сградата е тухла от 1940г. Покривът е ремонтиран 2017г. Съдействаме при необходимост от кредитиране. Идеална локация за инвестиционен имот. В момента има наемател, за оглед с предварителна уговорка на посочения телефон. (yavlenaCOM/127835).",cd3c4f56c766348e00357fc10496896741a0ccb3ae050d5d2b3037e4d7254939,98900,EUR,48,2060.42,ул. Екзарх Йосиф,2023-10-11 11:44:20.000,1
https://www.imot.bg/pcgi/imot.cgi?act=5&adv=1b169580533651841,град София,Център,"2-СТАЕН","Представяме Ви, просторен двустаен апартамент с възможност за преустройство в тристаен в сърцето на град София.Апартаментът се намира в изключителен район - в непосредствена близост са Президентство на Република България, Народното събрание на Република България, Министерски съвет както и знакови исторически и културни места за града.В близост се намират няколко големи вериги супермаркети -  Била  и  Лидъл . Жилището се намира в синя зона за паркиране.Имотът е разположен на втори жилищен етаж в сграда на 5 етажа с гледка към ул. Георги Бенковски, със застроена площ от 70 кв.м. В допълнение към имота има таван и мазе. Помещенията са с височина 3.20м.Разпределение: коридор, хол със светъл вестибюл, кухня с излаз на тераса, баня с тоалетна.Апартаментът е подходящ както за живеене, така и за офис, нотариална кантора и др.При интерес, можем да организираме оглед в удобно за вас време.+359876597218 / [email protected]",db06dfc765827bf74746eb29773822471643a7bc386f136d75ba8bdfeab835ba,220000,EUR,70,3142.86,ул. Московска,2023-10-11 11:43:35.000,1
https://www.imot.bg/pcgi/imot.cgi?act=5&adv=1b169581045465209,град София,Център,"2-СТАЕН","Представяме на вашето внимание двустаен  апартамент в Топ-център.Апартаментът е със следното разпределение: антре, две стаи, хол, кухня, баня с тоалетна, коридор и балконКъм апартамента има паркомясто, гараж.Апартаментът е за ремонт.Апартаментът е ситуиран на изключително комуникативно място, в близост до паметника на Васил Левски, църквата Александър Невски и Университетската ботаническа градина.За оглед или повече информация, моля, обадете се на посочения телефон! Агенцията предлага безплатно съдействие при жилищно кредитиране!Може да посетите нашия уебсайт, за да видите повече от нашите оферти: http://basproperties. bg",ad19f2549ff47f1f6d10853a77f2ece4251dabed2ba29c580339497c0b5a511e,360000,EUR,68,5294.12,Център,2023-11-02 13:46:29.000,1
https://www.imot.bg/pcgi/imot.cgi?act=5&adv=1b169581634442742,град София,Център,"2-СТАЕН","Предлагаме на вашето внимание просторен апартамент на топ локация, а именно ул.  'Любен Каравелов' и ул.'Проф.Никола Михайлов'.  Състои се от: две стаи, тъмен вестибюл, кухня с усвоен балкон, баня-тоалетна, килер, коридор.Масивна тухлена сграда, построена през 1949 година.Апартаментът е много добре поддържан и е в отлично състояние. Сменени: ВиК, ел.инсталация, радиатори. PVC дограма. Височина на таваните: 2,90 м.Общите части са без забележки.Към имота има: мазе 9,63 кв.м.и таван 11,21 кв.м.Отоплението е на ТЕЦ.Изложението: изток/западПешеходно разстояние до: Метростанция 'Св.Патриарх Евтимий'  - 1 мин. Метростанция 'Стадион Васил Левски' - 3 мин.НДК - 7 мин.Подходящ както за живеене, така и за инвестиция.  Оф.9236РАБОТИМ С КОЛЕГИ!  За повече информация и огледи, свържете се с нас на тел. 088 883 7572; 088 566 7599  или на e-mail: [email protected]",c45cb6a63264ae1c95591e74d2bc5b749f207c040922a4d5ece567b8a2e586bc,235000,EUR,87,2701.15,ул. Любен Каравелов,2023-10-11 11:42:38.000,1
https://www.imot.bg/pcgi/imot.cgi?act=5&adv=1b169586737826405,град София,Център,"2-СТАЕН","Двустаен апартамент с възможност за преустройство в тристаен, в жилищна сграда на ул. Бузлуджа, в района на НДК, Софийски Районен Съд и 'Фантастико'. Състои се от:  просторен хол, около 30 кв.м, кухня, спалня, баня , отделна тоалетна, коридор и балкон, общ за кухнята и спалнята. Кухнята и спалнята са с  приблизително еднакви площи, с изглед към вътрешен двор, който е много тих, а дневната е към ул. Бузлуджа. За ремонт. ТЕЦ. (yavlenaCOM/136109).","485118042040f6435de84901efa7257ac70cba6b1d647543062fdcb1eb3a1e71",239999,EUR,72,3333.32,Център,2023-10-16 08:12:32.000,1
https://www.imot.bg/pcgi/imot.cgi?act=5&adv=1b169589131287195,град София,Център,"2-СТАЕН","Просторен двустаен апартамент с възможност за преустройство в тристаен. Има следното пазпределение: голям хол с вестибюл, баня с тоалетна, отделна тоалетна, отделна кухня, спалня, килер и два усвоени балкона. Апартаментът е за освежителен ремонт, но е със сменена дограма. Има ТЕЦ. Добра локация. Тухлена сграда от 1965г. с асансьор. Възможност за преустройство в тристаен апартамент. Обади се сега и цитирай този код 596657",e4b4918028f93cfb57d9d3c0090f39215a72ef85c926a3da7a3d363fafd44687,169900,EUR,84,2022.62,Център,2023-10-13 10:36:46.000,1
https://www.imot.bg/pcgi/imot.cgi?act=5&adv=1b169589300638216,град София,Център,"2-СТАЕН","429695 Продавам обзаведено ателие в нова сграда на ул. Рила, в близост до пл. Лъвов мост. Състои се от просторна дневна с трапезария и светъл кухненски бокс, една самостоятелна спалня, антре, баня с тоалетна и две тераси. Изложението е изток, юг и север с хубави панорамни гледки.Имотът е със статут 'ателие'; Сградата има асансьор; Продава се с обзавеждане, което подлежи на уточнение; ЕТАП НА СТРОИТЕЛСТВО: разрешение за ползване (Акт 16); ОТОПЛЕНИЕ: ТЕЦ; Има 2 балкона/тераси; С довършителни дейности; Непреходен; ВИД СТРОИТЕЛСТВО: тухла; ЗАСТРОЕНА ПЛОЩ 100.64 кв.м; ГОДИНА НА СТРОИТЕЛСТВО: 2014 г.; ИЗЛОЖЕНИЕ: изток, север, юг; СПАЛНИ: 1; БАНИ: 1; ДОГРАМА: PVC_________________________________________________________________________________________________Към потенциалните продавачи! Ако продавате подобен имот или обмисляте дали да го направите в близко бъдеще, моля свържете се с мен. Имам клиенти, които търсят в района. Мога да дам ориентировъчна цена по телефон или имейл и по-точна цена при оглед на място.ОГЛЕДЪТ И КОНСУЛТАЦИЯТА СА БЕЗПЛАТНИ.МОЖЕТЕ СЪЩО ТАКА, ДА ПОДАДЕТЕ И БЕЗПЛАТНА ЧАСТНА ОБЯВА ЗА ПРОДАЖБА НА ВАШИЯ ИМОТ В MIRELA.BG, БЕЗ БРОКЕР И КОМИСИОНА. Виж по-малко... Виж повече","5f1d9692104ad756ba97136d7819bd9bd7763bc36fb0f13de7f2408406f302b4",169000,EUR,129,1310.08,Център,2023-10-11 11:45:54.000,1
https://www.imot.bg/pcgi/imot.cgi?act=5&adv=1b169590938771432,град София,Център,"2-СТАЕН","Завършен до ключ двустаен апартамент в нова тухлена сграда от 2022 г. Намира се на тихо място между ул. 'Опълченска' и бул. 'Христо Ботев', близо до метростанция и спирки на градски транспорт. Сградата е луксозно изпълнена с гранитни подови настилки и парапети от ковано желязо. Сградата е с Разрешение за ползване от 2022 година. Апартаментът е с изложение югозапад и запад. Състои се от входно антре, дневна с кухненски бокс, спалня, баня с тоалетна и две малки тераси. Жилището е завършено до ключ с качествени материали и не е живяно в него. Отоплението е на ТЕЦ. За повече информация и огледи Захари Цветков 0882 599 944, 0888 88 16 65 ","1be5695e3564547322d7349c3ebddf6961f72f9b77067bd2a7d69ac0d7a4dc11",124000,EUR,48,2583.33,Център,2023-10-11 11:44:00.000,1
https://www.imot.bg/pcgi/imot.cgi?act=5&adv=1b169596839222415,град София,Център,"2-СТАЕН","ДО ПАРК 'ЗАИМОВ'!!! В отлично състояние!!! Луксозно завършен двустаен непреходен апартамент в нова бутикова кооперация с АКТ 16 от 2017год. на метри от Метростанция. Разпределение: коридор, баня с тоалетна, дневна с кухненски бокс, спалня, тераса. Застроена площ-50,50кв.м. Статут-апартамент. Изложение-изток. Отлични общи части на кооперацията, контролиран достъп. За контакт и оглед:Емилия Нанева-0894418511, 0899995927","722aeca88c9a0f1a16fbdfae10eaefb898beb8a180e9c279154347f95ff06654",210000,EUR,64,3281.25,Център,2023-10-11 11:44:26.000,1
https://www.imot.bg/pcgi/imot.cgi?act=5&adv=1b169622509993831,град София,Център,"2-СТАЕН","Ул. '20 април' до ул. 'Лайош Кошут' В близост до Руски паметник и пл. Македония. Стая, трапезария/втора стая/, кухня, баня с тоалетна, балкон. ПВЦ. ТИХ. ТЕЦ. Тавани високи 3 метра. Гледа към градинката на Арменската църква/ североизток/. Стоманобетонно строителство от 1940г. Без асансьор. РАБОТИМ С КОЛЕГИ. С КЛЮЧ.ЗА ОСНОВЕН РЕМОНТ. 0889 550 950.","16c37f848a56445b18fe4002348ff68cbc2e1f52139a3442101f6155cdbb7e26",145000,EUR,44,3295.45,пл. Руски паметник,2023-10-11 11:46:18.000,1
https://www.imot.bg/pcgi/imot.cgi?act=5&adv=1b169623222441373,град София,Център,"2-СТАЕН","BARNES BULGARIA: www.barnes-bulgaria.comМоля, кажете, че сте видeли обявата в този сайт.Референтен номер: 83278556 - SOF-115571Представяме колекционерски апартамент с емблематична локация   ул. 'Московска' в центъра на София.Жилището е изцяло реновирано по дизайнерски проект, изпълнен с висококачествени материали и обзавеждане по поръчка.Сградата от 1929 г. е паметник на културата с отлични общи части, първият асансьор Schindler в София и е дело на арх. Парашкеванов.Имотът се намира на трети етаж, над партер, от общо шест етажа и се характеризира с много естествена светлина и гледки към сърцето на София.Високите тавани, естественият паркет в комбинация с висококачествен италиански гранитогрес, детайлите от естествен мрамор и дизайнерските решения за обзавеждане създават усещане за уют, стил и класа.Чистата застроена площ 80 кв. м е разпределена, както следва:  Входно антре с голям вграден гардероб;  Трапезария с маса за хранене от мрамор и витрини с лед осветление;  Дневна/ кът за отдих с мека мебел с електронно управление и функция за сън;  Спалня с балкон и дълбок гардероб;  Коридор;  Просторна баня с параван и прозорец за естествена светлина и вентилация;  Тоалетна с прозорец и пералня;  Напълно оборудвана кухня с вградени шкафове с лед осветление, работен плот от технически камък, хладилник, фурна, стъклокерамичен плот, абсорбатор, миялна машина и малка масичка за хранене.Предимства на имота:  Емблематична локация   ул. 'Московска';  В сграда паметник на културата без годишен данък сгради и такса поддръжка на общите части;  Без аналог на пазара;  Първият Schindler асансьор монтиран в София;  Високи тавани;  Подови настилки от естествен паркет и италиански гранитогрес;  Обзавеждане по индивидуален дизайнерски проект;  Висококачествени електроуреди;  Дограма с двоен стъклопакет;  Отопление с климатици;  Топла вода от ТЕЦ;  Избено помещение с площ 3 кв. м;  Таванско помещение с площ 4 кв. м.За повече информация свържете се с нас и цитирайте референтния номер на имота. Моля, кажете, че сте видeли обявата в този сайт.Референтен номер: 83278556 - SOF-115571Тел: 0884623039, 024269042Отговорен брокер: Филип Николов Виж по-малко... Виж повече","1663438cbe37feb0b751bd66b70adb20b3d3dd64c3e3dc1ade0c31f8418c3249",800000,EUR,80,10000.00,ул. Московска,2023-10-11 11:45:30.000,1
https://www.imot.bg/pcgi/imot.cgi?act=5&adv=1b169624382243889,град София,Център,"2-СТАЕН","БЕЗ КОМИСИОННА от купувача!Промоционална схема на плащане!20% при подписване на прдварителен договор и 80% при акт за собственост!ПОКУПКА ОТ ИНВЕСТИТОРА!Агенция за недвижими имоти Голдън Кий предлага НОВ ЛУКСОЗЕН ЗАТВОРЕН ЖИЛИЩЕН КОМПЛЕКС в централната част на гр. София, а именно: ШИРОК ЦЕНТЪР - в непосредствена близост до бул. цар Борис III, Медицинска Академия, Лагера, Руски паметник, хранителни магазини и супермаркети.Сградата е ПРЕД АКТ 15 и срок на завършване 2023 г. АКТ 16 !!!Избор на апартаменти.СТЕПЕН на завършеност:- 100% поставена хидроизолация- Над 95% изградена електрическа инсталация- Над 90% изградена ВиК инсталация- Над 100% поставени дограми- Над 80% поставена мазилкаПредлагаме Ви:2-стаен апартамент:Обща площ: 75,07 кв. м.Чиста застроена площ: 64 кв. м.Изложение: изтокОбщи части: 11,07 кв. м.ПРЕДИМСТВА:- Качествено строителство с висококачествени материали- Дългогодишен и доказан инвеститор- Идеална локация- Сигурност и поддръжка жива охрана и видеонаблюдение, озеленяване- Удобства: басейн, фитнес, паркоместа, паркова среда, детски площадки, беседки, зони за отдих и релакс.- Най-изгодните цени на пазара! ВЪЗМОЖНОСТИ: - Избор на тип апартамент, изложение и етаж- Кредитиране при преференциални условия- Гъвкави схеми за плащане- Инвестиционен проектЗа повече информация и огледи: 0876900845/0882442295Съдействаме за кредитиране от водещи банки при преференциални условия!Всички наши оферти можете да намерите на:www. goldenkeybg. comwww. gkeygroup. comoffice@gkeygroup. com Виж по-малко... Виж повече","0b6ed83452dd2065517cb57fbcb35548c9a37ad0610c90ad80e4a86e774dbc82",118978,EUR,75,1586.37,Център,2023-10-11 11:44:07.000,1
